jam,cuaca,suhu_C,kelembapan_RH_pct,heat_index_C,terasa_seperti_C,dew_point_C,tekanan_udara_hpa,peluang_hujan_pct,curah_hujan_p50_mm,curah_hujan_p90_mm,angin_kmh,hembusan_angin_p90_kmh,arah_angin_derajat,tutupan_awan_pct,jarak_pandang_p10_m,indeks_uv,risiko_hujan,saran
06:00,Berawan,13.0,96.0,13.0,12.6,11.8,1013.6,1.9,0.0,0.0,2.6,9.4,240.0,100.0,12320.0,0.0,low,Risiko relatif terkendali; keputusan normal masih masuk akal dengan pemantauan berkala.
09:00,Berawan,16.8,82.0,16.8,17.0,13.3,1014.8,2.4,0.0,0.0,2.5,15.1,164.0,100.0,18960.0,2.6,low,"Window relatif baik untuk aktivitas luar ruang, tetapi tetap cek update menjelang siang."
12:00,Berawan,19.8,64.0,19.8,20.8,13.7,1013.4,50.0,0.1,0.7,5.8,24.8,35.0,98.0,8900.0,7.8,medium,Risiko relatif terkendali; keputusan normal masih masuk akal dengan pemantauan berkala.
15:00,Hujan Ringan,17.4,87.0,17.4,18.5,15.1,1011.8,78.0,0.5,40.6,5.9,24.5,125.0,100.0,1480.0,6.2,very_high,"Bawa payung/jas hujan dan gunakan interpretasi konservatif, terutama jika keluar setelah siang."
18:00,Hujan Ringan,16.4,95.0,16.4,16.2,14.5,1012.7,71.9,0.2,23.1,3.6,19.8,207.0,100.0,1380.0,0.9,very_high,"Bawa payung/jas hujan dan gunakan interpretasi konservatif, terutama jika keluar setelah siang."
