jam,cuaca,suhu_C,kelembapan_RH_pct,heat_index_C,terasa_seperti_C,dew_point_C,tekanan_udara_hpa,peluang_hujan_pct,curah_hujan_p50_mm,curah_hujan_p90_mm,angin_kmh,hembusan_angin_p90_kmh,arah_angin_derajat,tutupan_awan_pct,jarak_pandang_p10_m,indeks_uv,risiko_hujan,saran
06:00,Berawan,14.7,89.0,14.7,15.1,13.2,1013.9,0.3,0.0,0.0,4.1,11.5,245.0,97.0,12880.0,0.0,low,Risiko relatif terkendali; keputusan normal masih masuk akal dengan pemantauan berkala.
09:00,Berawan,19.1,81.0,19.1,20.0,14.7,1014.9,0.0,0.0,0.0,3.1,15.8,68.0,100.0,21600.0,2.1,low,"Window relatif baik untuk aktivitas luar ruang, tetapi tetap cek update menjelang siang."
12:00,Hujan Ringan,22.2,69.0,22.2,23.3,16.1,1013.8,41.5,0.0,0.6,5.8,29.5,57.0,100.0,11740.0,4.7,medium,Risiko relatif terkendali; keputusan normal masih masuk akal dengan pemantauan berkala.
15:00,Hujan Ringan,19.4,84.1,19.4,21.8,17.3,1012.2,82.4,0.5,4.6,4.8,30.6,32.0,100.0,4920.0,4.5,high,"Bawa payung/jas hujan dan gunakan interpretasi konservatif, terutama jika keluar setelah siang."
18:00,Hujan Ringan,17.9,96.0,17.9,19.7,16.9,1012.8,84.5,1.0,8.9,3.6,20.5,163.0,100.0,5580.0,0.8,very_high,"Bawa payung/jas hujan dan gunakan interpretasi konservatif, terutama jika keluar setelah siang."
