jam,cuaca,suhu_C,kelembapan_RH_pct,heat_index_C,terasa_seperti_C,dew_point_C,tekanan_udara_hpa,peluang_hujan_pct,curah_hujan_p50_mm,curah_hujan_p90_mm,angin_kmh,hembusan_angin_p90_kmh,arah_angin_derajat,tutupan_awan_pct,jarak_pandang_p10_m,indeks_uv,risiko_hujan,saran
06:00,Berawan,15.1,90.0,15.1,15.1,12.7,1013.8,0.1,0.0,0.0,3.7,10.8,244.0,100.0,12960.0,0.0,low,Risiko relatif terkendali; keputusan normal masih masuk akal dengan pemantauan berkala.
09:00,Berawan,19.1,68.8,19.1,20.1,14.8,1015.1,0.0,0.0,0.0,2.3,15.1,110.0,99.0,18180.0,1.1,low,"Window relatif baik untuk aktivitas luar ruang, tetapi tetap cek update menjelang siang."
12:00,Berawan,22.0,68.0,22.0,23.3,16.0,1013.9,37.0,0.0,1.2,5.6,27.4,55.0,100.0,17100.0,4.8,medium,Risiko relatif terkendali; keputusan normal masih masuk akal dengan pemantauan berkala.
15:00,Hujan Ringan,20.1,80.0,20.1,22.0,17.2,1012.1,70.9,0.5,3.8,6.5,23.8,36.0,100.0,5820.0,4.0,high,"Bawa payung/jas hujan dan gunakan interpretasi konservatif, terutama jika keluar setelah siang."
18:00,Hujan Ringan,17.9,92.3,17.9,19.8,17.0,1012.7,70.5,0.3,2.4,2.9,16.9,144.0,100.0,5580.0,0.6,high,"Bawa payung/jas hujan dan gunakan interpretasi konservatif, terutama jika keluar setelah siang."
