jam,cuaca,suhu_C,kelembapan_RH_pct,heat_index_C,terasa_seperti_C,dew_point_C,tekanan_udara_hpa,peluang_hujan_pct,curah_hujan_p50_mm,curah_hujan_p90_mm,angin_kmh,hembusan_angin_p90_kmh,arah_angin_derajat,tutupan_awan_pct,jarak_pandang_p10_m,indeks_uv,risiko_hujan,saran
06:00,Berawan,14.1,87.0,14.1,14.1,11.8,1011.1,0.0,0.0,0.0,7.4,29.9,242.0,100.0,17120.0,0.0,low,Risiko relatif terkendali; keputusan normal masih masuk akal dengan pemantauan berkala.
09:00,Berawan,19.4,73.3,19.4,20.2,13.5,1012.2,0.0,0.0,0.0,4.0,20.9,267.0,100.0,22960.0,2.4,low,"Window relatif baik untuk aktivitas luar ruang, tetapi tetap cek update menjelang siang."
12:00,Berawan,23.1,57.0,23.1,25.5,13.9,1010.7,19.1,0.0,0.5,3.9,32.8,255.0,100.0,24140.0,7.7,low,Risiko relatif terkendali; keputusan normal masih masuk akal dengan pemantauan berkala.
15:00,Hujan Ringan,21.8,71.1,21.8,23.6,15.2,1009.2,61.3,0.2,0.8,5.8,39.6,268.0,100.0,24140.0,4.2,medium,"Bawa payung/jas hujan dan gunakan interpretasi konservatif, terutama jika keluar setelah siang."
18:00,Berawan,18.9,84.2,18.9,20.7,16.1,1010.2,50.3,0.0,1.2,2.1,23.8,234.0,100.0,11920.0,1.0,medium,"Bawa payung/jas hujan dan gunakan interpretasi konservatif, terutama jika keluar setelah siang."
