jam,cuaca,suhu_C,kelembapan_RH_pct,heat_index_C,terasa_seperti_C,dew_point_C,tekanan_udara_hpa,peluang_hujan_pct,curah_hujan_p50_mm,curah_hujan_p90_mm,angin_kmh,hembusan_angin_p90_kmh,arah_angin_derajat,tutupan_awan_pct,jarak_pandang_p10_m,indeks_uv,risiko_hujan,saran
06:00,Berawan,15.0,94.9,15.0,15.2,13.6,1011.7,0.0,0.0,0.0,6.9,29.5,244.0,99.0,18080.0,0.0,low,Risiko relatif terkendali; keputusan normal masih masuk akal dengan pemantauan berkala.
09:00,Berawan,19.4,77.0,19.4,20.7,14.8,1012.9,0.0,0.0,0.0,2.8,18.4,231.0,96.0,23600.0,2.6,low,"Window relatif baik untuk aktivitas luar ruang, tetapi tetap cek update menjelang siang."
12:00,Hujan Ringan,22.9,69.0,22.9,24.6,15.7,1011.6,39.0,0.0,0.4,5.4,41.0,179.0,99.0,6920.0,7.5,medium,Risiko relatif terkendali; keputusan normal masih masuk akal dengan pemantauan berkala.
15:00,Hujan Ringan,20.0,82.0,20.0,23.3,17.3,1010.3,70.5,0.3,5.7,4.4,40.0,206.0,100.0,7640.0,6.2,high,"Bawa payung/jas hujan dan gunakan interpretasi konservatif, terutama jika keluar setelah siang."
18:00,Berawan,18.2,91.0,18.2,20.7,17.2,1011.2,50.4,0.0,0.6,1.8,23.0,221.0,100.0,16180.0,1.0,medium,"Bawa payung/jas hujan dan gunakan interpretasi konservatif, terutama jika keluar setelah siang."
