jam,cuaca,suhu_C,kelembapan_RH_pct,heat_index_C,terasa_seperti_C,dew_point_C,tekanan_udara_hpa,peluang_hujan_pct,curah_hujan_p50_mm,curah_hujan_p90_mm,angin_kmh,hembusan_angin_p90_kmh,arah_angin_derajat,tutupan_awan_pct,jarak_pandang_p10_m,indeks_uv,risiko_hujan,saran
06:00,Berawan,12.7,74.0,12.7,12.8,9.8,1013.5,0.0,0.0,0.0,8.5,31.0,241.0,99.0,18280.0,0.0,low,Risiko relatif terkendali; keputusan normal masih masuk akal dengan pemantauan berkala.
09:00,Berawan,18.9,61.0,18.9,19.0,11.3,1014.6,0.0,0.0,0.0,2.9,25.9,219.0,97.0,20960.0,2.6,low,"Window relatif baik untuk aktivitas luar ruang, tetapi tetap cek update menjelang siang."
12:00,Berawan,23.0,49.0,23.0,24.9,12.2,1013.2,0.0,0.0,0.0,3.6,30.2,161.0,95.0,22340.0,7.9,low,Risiko relatif terkendali; keputusan normal masih masuk akal dengan pemantauan berkala.
15:00,Berawan,22.2,59.0,22.2,23.6,14.3,1011.2,23.5,0.0,0.2,7.2,34.6,81.0,94.0,20800.0,6.2,low,Risiko relatif terkendali; keputusan normal masih masuk akal dengan pemantauan berkala.
18:00,Hujan Ringan,18.4,87.0,18.4,20.5,16.4,1012.6,54.0,0.2,0.5,4.0,26.6,135.0,78.0,10240.0,1.2,medium,"Bawa payung/jas hujan dan gunakan interpretasi konservatif, terutama jika keluar setelah siang."
