jam,cuaca,suhu_C,kelembapan_RH_pct,heat_index_C,terasa_seperti_C,dew_point_C,tekanan_udara_hpa,peluang_hujan_pct,curah_hujan_p50_mm,curah_hujan_p90_mm,angin_kmh,hembusan_angin_p90_kmh,arah_angin_derajat,tutupan_awan_pct,jarak_pandang_p10_m,indeks_uv,risiko_hujan,saran
06:00,Berawan,13.3,76.0,13.3,13.7,10.5,1013.5,0.0,0.0,0.0,7.9,31.0,237.0,97.0,18280.0,0.0,low,Risiko relatif terkendali; keputusan normal masih masuk akal dengan pemantauan berkala.
09:00,Berawan,19.5,62.4,19.5,19.8,12.1,1014.6,0.0,0.0,0.0,3.0,25.9,214.0,97.0,20960.0,2.7,low,"Window relatif baik untuk aktivitas luar ruang, tetapi tetap cek update menjelang siang."
12:00,Berawan,23.6,51.0,23.6,26.0,13.3,1013.2,0.0,0.0,0.0,3.6,30.2,197.0,95.0,22340.0,7.8,low,Risiko relatif terkendali; keputusan normal masih masuk akal dengan pemantauan berkala.
15:00,Berawan,22.8,59.0,22.8,24.6,15.4,1011.3,30.3,0.0,0.4,4.8,34.6,123.0,94.0,20800.0,5.5,low,Risiko relatif terkendali; keputusan normal masih masuk akal dengan pemantauan berkala.
18:00,Hujan Ringan,19.3,87.0,19.3,21.5,17.1,1012.6,54.0,0.1,0.3,4.7,26.6,182.0,78.0,10240.0,1.2,medium,"Bawa payung/jas hujan dan gunakan interpretasi konservatif, terutama jika keluar setelah siang."
