jam,cuaca,suhu_C,kelembapan_RH_pct,heat_index_C,terasa_seperti_C,dew_point_C,tekanan_udara_hpa,peluang_hujan_pct,curah_hujan_p50_mm,curah_hujan_p90_mm,angin_kmh,hembusan_angin_p90_kmh,arah_angin_derajat,tutupan_awan_pct,jarak_pandang_p10_m,indeks_uv,risiko_hujan,saran
06:00,Berawan,15.0,83.3,15.0,16.0,13.7,1013.1,0.0,0.0,0.0,5.04,23.0,242.0,100.0,16860.0,0.0,low,Risiko relatif terkendali; keputusan normal masih masuk akal dengan pemantauan berkala.
09:00,Berawan,19.3,67.0,19.3,20.7,15.1,1014.4,7.4,0.0,0.3,2.3,19.4,192.0,100.0,22500.0,2.6,low,"Window relatif baik untuk aktivitas luar ruang, tetapi tetap cek update menjelang siang."
12:00,Berawan,23.0,56.8,23.0,24.2,15.2,1013.2,14.8,0.0,1.0,4.7,24.8,195.0,100.0,8680.0,6.8,low,Risiko relatif terkendali; keputusan normal masih masuk akal dengan pemantauan berkala.
15:00,Hujan Ringan,22.0,68.0,22.0,24.0,17.0,1011.4,52.9,0.1,1.2,3.2,34.9,122.0,100.0,6020.0,5.7,medium,"Bawa payung/jas hujan dan gunakan interpretasi konservatif, terutama jika keluar setelah siang."
18:00,Hujan Ringan,19.2,88.0,19.2,21.5,17.7,1012.3,72.2,0.2,1.5,2.9,34.6,186.0,100.0,12200.0,0.9,medium,"Bawa payung/jas hujan dan gunakan interpretasi konservatif, terutama jika keluar setelah siang."
