jam,cuaca,suhu_C,kelembapan_RH_pct,heat_index_C,terasa_seperti_C,dew_point_C,tekanan_udara_hpa,peluang_hujan_pct,curah_hujan_p50_mm,curah_hujan_p90_mm,angin_kmh,hembusan_angin_p90_kmh,arah_angin_derajat,tutupan_awan_pct,jarak_pandang_p10_m,indeks_uv,risiko_hujan,saran
06:00,Berawan,15.1,84.1,15.1,15.8,13.6,1013.0,0.1,0.0,0.0,5.4,22.3,243.0,100.0,13460.0,0.0,low,Risiko relatif terkendali; keputusan normal masih masuk akal dengan pemantauan berkala.
09:00,Berawan,19.2,79.0,19.2,20.7,15.1,1014.4,7.5,0.0,0.6,2.7,16.9,210.0,100.0,20940.0,2.5,low,"Window relatif baik untuk aktivitas luar ruang, tetapi tetap cek update menjelang siang."
12:00,Berawan,22.5,69.0,22.5,24.7,15.4,1013.1,15.7,0.0,0.7,5.1,27.4,116.0,99.0,13340.0,7.2,low,Risiko relatif terkendali; keputusan normal masih masuk akal dengan pemantauan berkala.
15:00,Hujan Ringan,22.0,68.0,22.0,24.3,16.7,1011.3,62.0,0.1,1.1,4.2,32.4,109.0,100.0,6020.0,5.8,medium,"Bawa payung/jas hujan dan gunakan interpretasi konservatif, terutama jika keluar setelah siang."
18:00,Hujan Ringan,19.2,90.0,19.2,21.8,17.8,1012.4,73.6,0.2,0.8,2.2,28.8,212.0,100.0,980.0,0.8,medium,"Bawa payung/jas hujan dan gunakan interpretasi konservatif, terutama jika keluar setelah siang."
