jam,cuaca,suhu_C,kelembapan_RH_pct,heat_index_C,terasa_seperti_C,dew_point_C,tekanan_udara_hpa,peluang_hujan_pct,curah_hujan_p50_mm,curah_hujan_p90_mm,angin_kmh,hembusan_angin_p90_kmh,arah_angin_derajat,tutupan_awan_pct,jarak_pandang_p10_m,indeks_uv,risiko_hujan,saran
06:00,Berawan,16.6,87.0,16.6,17.9,14.6,1011.1,0.0,0.0,0.0,6.9,29.5,240.0,100.0,15300.0,0.0,low,Risiko relatif terkendali; keputusan normal masih masuk akal dengan pemantauan berkala.
09:00,Berawan,22.1,73.0,22.1,23.9,16.2,1012.1,0.0,0.0,0.0,4.6,23.8,214.0,100.0,24140.0,2.6,low,"Window relatif baik untuk aktivitas luar ruang, tetapi tetap cek update menjelang siang."
12:00,Berawan,25.1,61.8,25.1,28.4,16.6,1010.7,25.5,0.0,1.0,7.6,29.2,255.0,100.0,24140.0,7.1,low,Risiko relatif terkendali; keputusan normal masih masuk akal dengan pemantauan berkala.
15:00,Hujan Ringan,23.9,69.0,23.9,27.0,18.4,1009.2,63.2,0.2,1.8,6.5,39.6,247.0,100.0,11740.0,4.5,medium,"Bawa payung/jas hujan dan gunakan interpretasi konservatif, terutama jika keluar setelah siang."
18:00,Berawan,20.7,90.0,20.7,24.1,18.9,1010.4,48.9,0.0,0.9,5.1,27.0,258.0,100.0,17900.0,0.8,medium,"Bawa payung/jas hujan dan gunakan interpretasi konservatif, terutama jika keluar setelah siang."
