jam,cuaca,suhu_C,kelembapan_RH_pct,heat_index_C,terasa_seperti_C,dew_point_C,tekanan_udara_hpa,peluang_hujan_pct,curah_hujan_p50_mm,curah_hujan_p90_mm,angin_kmh,hembusan_angin_p90_kmh,arah_angin_derajat,tutupan_awan_pct,jarak_pandang_p10_m,indeks_uv,risiko_hujan,saran
06:00,Berawan,14.5,76.0,14.5,15.5,11.9,1013.4,0.0,0.0,0.0,7.9,31.0,232.0,97.0,18280.0,0.0,low,Risiko relatif terkendali; keputusan normal masih masuk akal dengan pemantauan berkala.
09:00,Berawan,20.7,62.4,20.7,21.5,13.5,1014.5,0.0,0.0,0.0,3.0,25.9,206.0,90.0,20960.0,2.7,low,"Window relatif baik untuk aktivitas luar ruang, tetapi tetap cek update menjelang siang."
12:00,Berawan,25.0,51.0,25.0,27.5,14.7,1013.0,0.0,0.0,0.0,3.6,30.2,191.0,95.0,22340.0,7.8,low,Risiko relatif terkendali; keputusan normal masih masuk akal dengan pemantauan berkala.
15:00,Berawan,23.9,59.0,23.9,26.1,16.7,1011.0,27.9,0.0,0.4,4.8,34.6,131.0,100.0,20800.0,5.5,low,Risiko relatif terkendali; keputusan normal masih masuk akal dengan pemantauan berkala.
18:00,Hujan Ringan,20.4,87.0,20.4,23.2,18.3,1012.3,51.6,0.1,0.3,4.7,26.6,202.0,85.0,10240.0,1.2,medium,"Bawa payung/jas hujan dan gunakan interpretasi konservatif, terutama jika keluar setelah siang."
