jam,cuaca,suhu_C,kelembapan_RH_pct,heat_index_C,terasa_seperti_C,dew_point_C,tekanan_udara_hpa,peluang_hujan_pct,curah_hujan_p50_mm,curah_hujan_p90_mm,angin_kmh,hembusan_angin_p90_kmh,arah_angin_derajat,tutupan_awan_pct,jarak_pandang_p10_m,indeks_uv,risiko_hujan,saran
06:00,Berawan,16.0,84.1,16.0,17.2,14.6,1013.0,0.1,0.0,0.0,5.4,22.3,244.0,100.0,13460.0,0.0,low,Risiko relatif terkendali; keputusan normal masih masuk akal dengan pemantauan berkala.
09:00,Berawan,20.4,78.7,20.4,22.2,16.0,1014.4,7.5,0.0,0.1,2.7,16.9,201.0,100.0,20940.0,2.6,low,"Window relatif baik untuk aktivitas luar ruang, tetapi tetap cek update menjelang siang."
12:00,Berawan,23.9,61.0,23.9,26.5,16.2,1013.1,15.7,0.0,0.6,4.3,27.4,119.0,99.0,13340.0,7.8,low,Risiko relatif terkendali; keputusan normal masih masuk akal dengan pemantauan berkala.
15:00,Hujan Ringan,22.8,68.0,22.8,25.9,17.7,1011.3,62.0,0.1,0.8,6.1,32.4,113.0,100.0,6020.0,5.2,medium,"Bawa payung/jas hujan dan gunakan interpretasi konservatif, terutama jika keluar setelah siang."
18:00,Hujan Ringan,20.8,90.0,20.8,23.1,18.7,1012.4,73.6,0.2,0.8,2.2,28.8,208.0,100.0,980.0,0.5,medium,"Bawa payung/jas hujan dan gunakan interpretasi konservatif, terutama jika keluar setelah siang."
